doc_id,advocate_argument,skeptic_argument,is_green_tech,judge_rationale
9315787,"The DNA polymerase patent represents a significant step forward in green biotechnology – a move toward precision, efficiency, and reduced environmental impact. The targeted amino acid modifications, combined with the high degree of similarity to SEQ ID NO:38, demonstrate a deliberate effort to optimize an existing enzyme, reducing resource consumption and minimizing the risk of unintended consequences. This aligns perfectly with the core principles of CPC Y02, particularly its focus on biotechnological processes that minimize environmental impact and promote sustainable enzyme efficiency.","Classifying this DNA polymerase solely under CPC Y02 risks overstating its green credentials. The claim’s reliance on a pre-existing, naturally occurring enzyme, coupled with the ‘at least 95% identical’ specification, suggests a refinement rather than a revolutionary advancement. The focus on optimization doesn’t inherently guarantee a reduced environmental impact, and the potential for unforeseen interactions remains a concern. A more nuanced CPC classification is warranted, considering the technology’s true impact.",1,"The evidence presented by both the advocate and skeptic highlights a critical point: the patent’s green technology potential hinges on the *application* of the modified polymerase. While the modifications themselves – specifically the targeted amino acid changes – represent a move towards precision and efficiency, reducing the risk of unintended consequences, the core innovation remains the optimization of a pre-existing enzyme. Therefore, based on the arguments presented, a classification under CPC Y02 is justified, acknowledging the potential for reduced environmental impact contingent on the specific application of this enhanced polymerase."
9334087,"This patent claim describes a novel standing pouch design utilizing a chemical reaction within a contained space to actively control the temperature of its contents. The core innovation is the controlled heat transfer achieved through an exothermic or endothermic reaction, directly aligning with the definition of ‘heat treatment’ as a process for modifying materials through heat. The potential for sustainable cooling/heating using benign reactants further strengthens the argument for Y02 classification, reflecting a green technology application.","The patent’s description focuses on a packaging design and fluid handling system, not a genuine heat treatment process. The reaction within the pouch is a consequence of reactant mixing, not a deliberate heating step. The temperature change is a result of the reaction, not the primary heat treatment. The system operates on passive regulation, akin to a thermos, and lacks the active heat generation required for Y02 classification.",1,"While the advocate’s argument correctly identifies the core function as temperature control via a chemical reaction, the skeptic’s concerns regarding the lack of active heat generation are valid. The patent’s description leans heavily on the packaging design and fluid dynamics, making a strong case for Y02 classification based on the *process* of heat transfer, even if it’s induced rather than directly applied. The potential for sustainable cooling/heating adds further weight to this classification."
9686855,"This patent claim, detailing a multilayer ceramic capacitor with an interposer, should be classified under CPC Y02 – “Electrical Contacts; Electrical Connections.” The engineered voids and optimized solder usage within the interposer represent a crucial advancement directly impacting sustainability and warrant Y02 classification due to reduced energy loss, material efficiency, and improved thermal management.","The patent’s claims regarding energy efficiency and material reduction are overstated and primarily driven by cost optimization. The changes – voids and reduced solder – are incremental improvements in existing MLCC design practices, not a revolutionary shift towards green technology. The broad Y02 classification is inappropriate given the patent’s generic description and lack of quantifiable environmental impact data.",0,"The arguments presented highlight a key tension: the patent’s design incorporates elements that *could* contribute to efficiency, but the core claims of significant environmental benefit are not sufficiently substantiated. The focus on cost reduction rather than fundamental technological innovation weakens the justification for Y02 classification. A more targeted classification reflecting the specific MLCC design and its minor modifications would be more appropriate."
9551706,"The patent describes a novel method for detecting density differences using magnetic properties, offering a non-destructive, environmentally friendly alternative to traditional chemical methods. The use of paramagnetic/superparamagnetic fluids and a density-modifying agent, combined with magnetic field application, represents a significant advancement within the scope of Y02 – ‘Methods of Testing – Magnetic Testing’. The method’s potential for precision, efficiency, and alignment with emerging green technologies strongly supports classification under Y02.","The patent’s description primarily outlines a method of density detection, relying on a density-modifying agent and magnetic field interaction. While potentially beneficial, it doesn’t represent a fundamentally new or inventive application of magnetic testing. The reliance on a ‘density modifying agent’ introduces significant uncertainty regarding its environmental impact and the overall sustainability of the process. Classifying it under Y02 is overly broad and misinterprets the core inventive step, leaning towards a descriptive method rather than a technological advancement.",0,"The arguments presented highlight a valid, though not groundbreaking, application of magnetic principles for density measurement. While the advocate’s points regarding reduced environmental impact and potential for precision are persuasive, the skeptic’s concerns about the lack of a truly novel method and the reliance on a potentially problematic ‘density modifying agent’ are well-founded. The patent’s core contribution appears to be a specific procedural method rather than a fundamentally new magnetic testing technique, leading to a rejection of Y02 classification."
9745777,"An electronically controlled hatch system for limiting ingress/egress utilizes precision airflow regulation for energy efficiency and environmental control. The system’s electronically controlled actuator and latching system allows for modulating airflow, directly aligning with the principles of Y02 – ‘Control systems for valves and flow regulation.’ The potential applications, including industrial process optimization and HVAC systems, further strengthen the argument for Y02 classification due to the system’s ability to precisely manage airflow.","The patent claim describes a mechanical hatch system with electronic control, lacking a robust connection to the core principles of flow regulation as understood within Y02. The argument relies on speculative interpretation of ‘airflow regulation’ and fails to demonstrate specific flow control mechanisms, sensors, or feedback loops. Classifications within Y02F or Y02C would be more appropriate due to the system’s mechanical nature and absence of demonstrable flow control capabilities.",0,"Both arguments highlight valid points. The advocate correctly identifies the potential for airflow regulation as a key benefit, but the skeptic’s critique regarding the lack of demonstrable flow control mechanisms is crucial. While the electronic control adds a layer of sophistication, the fundamental description remains a mechanical hatch system. Therefore, based on the evidence presented, a Y02 classification is not fully supported, as the claim doesn't sufficiently demonstrate a system designed for active flow regulation as defined within Y02."
9237703,"This patent, claiming an inbred maize variety (PH1D9J) secured through an ATCC deposit, fundamentally contributes to sustainable agriculture by conserving valuable genetic resources and potentially enhancing crop yields. The claim aligns directly with Y02’s focus on plant propagation and breeding, particularly given the increasing importance of utilizing plant genetic material for resilience and optimized resource use. The ATCC deposit signifies a deliberate effort to secure and utilize this variety, supporting the broader goals of green technology and sustainable food systems.","While the claim references an ATCC deposit, simply possessing an inbred maize variety doesn’t inherently qualify it for Y02. Y02 focuses on *inventive* plant breeding techniques, not merely the preservation of existing varieties. The claim lacks evidence of a novel breeding process, and classifying it solely under Y02 risks overbroadly interpreting the heading’s scope. A more appropriate initial classification would be C12, reflecting the core activity of securing and potentially leveraging a specific plant variety.",1,"The arguments presented highlight a valid point regarding the scope of Y02. However, the evidence – the ATCC deposit and the claim of an inbred variety – strongly supports a classification under Y02. The patent’s core activity aligns with Y02’s focus on plant breeding and conservation, particularly in the context of securing a valuable genetic resource for sustainable agriculture. The skeptic’s argument regarding the lack of a novel breeding process is a reasonable consideration, but the claim’s focus on a specific, preserved variety justifies Y02 classification."
9273641,"This gas flow unit, with its engineered prolongation and dividing wall, clearly falls under CPC Y02 – Fluid Machinery due to its design for optimized gas flow. The angled flow, dual-sphere shape, and dividing wall are key features that enhance efficiency, reduce turbulence, and minimize energy loss – all hallmarks of green technology and a core focus of Y02 classification. The patent’s design directly addresses the need for improved fluid dynamics for enhanced performance, aligning perfectly with the goals of reducing energy consumption and waste, which are central to green technology applications.","While the patent describes a complex gas flow unit, classifying it under CPC Y02 – Fluid Machinery is an overreach. The description lacks any demonstrable environmental benefit or innovative design that warrants this classification. The intricate features – the dual-sphere prolongation and dividing wall – could actually *increase* complexity, manufacturing costs, and potential waste. Furthermore, Y02 is a broad classification, and this unit appears to be a specialized flow path rather than a fundamentally new type of fluid machinery. Alternative classifications like Y02M or Y02C are more appropriate.",0,"The arguments presented highlight a key tension in the classification process: the patent’s design features – specifically the prolongation and dividing wall – suggest an attempt at optimized gas flow, aligning with the goals of Y02. However, the skeptic’s concerns regarding increased complexity and the lack of demonstrable environmental benefit outweigh the advocate’s claims. The patent description lacks sufficient evidence to definitively establish the unit as a ‘green’ technology or a fundamentally innovative fluid machinery design deserving of Y02 classification. Therefore, based on the presented arguments, a classification under Y02 is not warranted."
9206804,"This patent describes a vehicle compressor incorporating design features – a coil spring, bearing system, and shaft diameter optimization – specifically intended to minimize energy consumption and reduce friction, aligning with Y02’s focus on mechanical engineering systems and efficiency. The design directly addresses key Y02 objectives of reduced emissions and sustainable mechanical engineering practices, representing a tangible application of green technology principles.","The patent describes a conventional vehicle compressor design with incremental improvements like a spring and bearing system. While these features contribute to reduced friction and potentially increased lifespan, they do not fundamentally alter the energy-intensive nature of compressor technology or represent a significant innovation warranting Y02 classification as ‘green technology.’ The focus on minor optimizations distracts from the core environmental impact of compressor operation.",0,"The arguments presented highlight a fundamental disagreement regarding the interpretation of ‘green technology’ within the context of CPC Y02. While the advocate correctly identifies design elements aimed at efficiency, the skeptic’s points regarding the inherent energy demands of compressors and the lack of a truly novel approach undermine the claim of significant environmental benefit. The patent describes a conventional design with incremental improvements, not a transformative innovation, and therefore does not meet the criteria for Y02 classification as a green technology."
8466241,"This patent claim, through its emphasis on controlled reaction parameters, minimizes waste, considers solvent selection within green chemistry principles, and aims to produce polymers with enhanced, sustainable performance characteristics, firmly positions it within the scope of CPC Y02. The claim’s focus on CRP implied by the detailed control over initiator concentration, temperature, and solvent selection aligns perfectly with Y02’s goal of efficient reactions and minimizing raw material usage, a core principle of sustainable polymer production. The potential for enhanced material properties and durability further strengthens the argument for Y02 classification, contributing to a reduced lifecycle environmental footprint.","While the claim touches upon elements associated with green polymerization, the significant ambiguities and lack of concrete data weaken the justification for a strong Y02 classification. The lack of specific details regarding the CRP technique employed, overly broad parameters within the temperature and solvent ranges, and the absence of any quantification of waste reduction or environmental benefits raise concerns. Furthermore, the claim lacks any consideration of the entire polymer lifecycle, which is crucial for a truly sustainable technology. Therefore, alternative CPC classifications, such as Y02C – Polymerization Processes, or potentially even Y02H – Polymer Materials, might be more appropriate, pending further clarification.",1,"The advocate’s argument successfully highlights the controlled nature of the polymerization process and its potential to reduce waste and optimize material properties, aligning with Y02’s objectives. However, the skeptic’s concerns regarding the lack of specificity – particularly concerning the CRP technique – and the absence of quantifiable data regarding environmental benefits are valid. While the claim suggests a green approach, the vagueness prevents a definitive classification under Y02. Therefore, a cautious approach is warranted, leaning towards Y02 due to the implied control and optimization efforts, but acknowledging the need for further clarification to solidify the green technology aspects."
8581146,"This welding wire feeding apparatus represents a significant advancement in sustainable welding practices. The integrated short circuit detection, automated distance control, and voltage monitoring system directly address key Y02 principles – minimizing waste, optimizing energy consumption, and enhancing weld quality. The system’s proactive approach to preventing short circuits, coupled with its real-time process control capabilities, makes it a valuable contribution to green welding, justifying classification under CPC Y02.","The patent’s core functionality – short circuit detection – is primarily a safety feature, not a green technology innovation. The claimed benefits regarding waste reduction and energy optimization are largely speculative and lack quantifiable evidence. The inclusion of a voltage monitoring system may actually increase energy consumption, and the system relies on established welding practices, making Y02 an overreach for this classification.",0,"The arguments presented highlight a fundamental tension between the patent’s safety-oriented features and the broader goals of CPC Y02. While the short circuit detection system is undoubtedly beneficial for safety, the evidence presented does not sufficiently demonstrate a significant, demonstrable contribution to sustainable welding practices as defined by Y02. The skeptic’s concerns regarding potential energy consumption and the reliance on established techniques are valid and outweigh the advocate’s claims of innovation. Therefore, a classification under Y02 is not warranted based on the presented arguments."
8975201,"The patent claim describes a novel process for manufacturing a matrix material using geopolymer technology, significantly reducing carbon emissions compared to traditional Portland cement production. Utilizing a mineral containing nanocrystalline cristobalite further enhances material properties and represents a circular economy approach, firmly placing it within CPC Y02 – ‘Production of Cements, Plasters, Stuccos, Lithographic Materials, and Related Articles’ due to its core function as a matrix material for construction applications.","The claim’s reliance on geopolymer synthesis, a broad term encompassing various material production methods, overstates the connection to Y02. The specific chemical formulation of potassium polysiloxonate and the inclusion of cristobalite as a component, rather than the defining process, suggest a more appropriate classification within CPC A43 – ‘Concrete, Mortar and Related Articles’ or A46 – ‘Adhesives and Sealants,’ focusing on the material’s function and properties rather than the production method itself.",0,"The advocate’s argument correctly identifies the potential environmental benefits of the geopolymer process but fails to adequately address the broader CPC classification scheme. The skeptic’s position is more accurate, as the claim’s focus on the specific chemical synthesis and material composition, rather than the overall production method, aligns more closely with the functional aspects of concrete and mortar production as defined in CPC A43. Therefore, the patent should be classified under CPC A43."
9732596,"This patent claims a significant advancement in subsea hydrocarbon well commissioning through a thermally insulated double-walled pipe system. The core innovation lies in minimizing energy consumption and reducing the risk of blowouts by controlling thermal stress, directly contributing to green technology principles. The robust design, coupled with a streamlined assembly method, represents a shift towards a more efficient and environmentally responsible approach to subsea operations, firmly placing it within the scope of CPC Y02 – ‘Methods of Drilling and Well Drilling.’","Classifying this patent primarily under CPC Y02 is a misinterpretation of its core function. The thermal insulation is a secondary benefit, not the driving innovation. The invention is fundamentally a robust method for connecting pipe segments, aligning more closely with CPC Y02M – ‘Methods of Subsea Well Construction’ and F16L – ‘Lifting Machines and Hoists.’ The emphasis on risk mitigation and energy reduction is standard engineering practice, not a defining characteristic of ‘green technology,’ and the assembly method is a well-established technique.",0,"Both arguments present valid points. The advocate correctly identifies the thermal insulation as a key element, but overstates its significance as a core green technology innovation. The skeptic accurately highlights the fundamental nature of the invention as a robust connection method and proposes more appropriate CPC classifications. Considering the evidence, the patent’s primary function – the engineered connection of subsea pipe segments – leans towards Y02M, making it a reasonable classification, though the ‘green’ aspects are secondary and not the defining feature of the invention."
8661630,"This patent claim represents a significant advancement in implantable device fabrication utilizing bio-based, biodegradable polymers with precisely controlled properties. The method’s inherent focus on sustainability, waste reduction, biocompatibility, and efficient manufacturing processes unequivocally positions it within the scope of CPC Y02. The use of PLLA-GA-CL terpolymers, tailored with controlled L-lactide content, is a cornerstone of green technology, minimizing reliance on fossil fuels and promoting a reduced carbon footprint. The controlled degradation profile further minimizes waste and resource consumption, aligning perfectly with the principles of Y02.","While the polymers themselves are derived from renewable sources, the production of L-lactide, the monomer for PLLA, is an energy-intensive process with a substantial carbon footprint. The ‘controlled degradation’ introduces complexities regarding potential microplastic pollution and doesn’t inherently reduce the overall environmental impact. The ‘coating’ process itself introduces significant environmental concerns, including solvent use and energy consumption, making Y02 an oversimplified classification. Alternative CPC classifications like Y02E, A61K, or C23 are more appropriate.",0,"The arguments presented highlight a critical tension. While the advocate correctly identifies the use of bio-based polymers as a key element of green technology, the skeptic’s concerns regarding the energy-intensive production of the monomers and the potential environmental impacts of the coating process significantly weaken the case for Y02. The claim’s focus on material preparation, as defined by Y02, doesn’t fully encompass the complex lifecycle assessment and manufacturing considerations necessary to definitively classify this invention as a green technology. Therefore, based on the presented arguments, a classification under Y02 is not warranted."
9484843,"The patent describes a highly efficient electric circuit utilizing a single power amplifier to drive two piezoelectric actuators in a push-pull configuration. This design dramatically reduces energy waste compared to traditional methods, minimizes thermal emissions, and has significant potential applications in renewable energy and smart systems, aligning directly with the core principles of green technology and the classification criteria for Y02 – ‘Piezoelectric Devices.’ The strategic use of a diode further enhances efficiency and longevity.","While piezoelectric actuators can be used in green applications, this patent claim lacks demonstrable environmental benefit. The push-pull operation introduces complexity and potential instability, and the diode adds a component with a finite lifespan and disposal issues. The claim’s focus on potential efficiency ignores the broader lifecycle impact of the circuit and doesn’t justify classification under Y02 without specific application context and evidence of reduced environmental impact.",0,"The arguments present a reasonable debate. The advocate’s emphasis on energy efficiency and potential applications within green technologies is compelling, particularly regarding reduced thermal emissions. However, the skeptic’s concerns regarding complexity, lifecycle impacts, and the lack of a defined application context are equally valid. Given the absence of concrete evidence demonstrating a net environmental benefit within the claim itself, and considering the potential for misuse, a classification under Y02 is not definitively supported. Further information regarding the intended application and performance metrics would be required to make a stronger determination."
9703511,"This patent claim describes a novel method for optimizing network communication by dynamically controlling connections based on data source origin. This intelligent management directly reduces energy consumption by minimizing unnecessary data transfer and connection durations, aligning with the core principles of green technology and the scope of CPC Y02 – ‘Methods of Communication – Network Communication.’ The selective disconnection mechanism, combined with the data source determination, represents a proactive approach to sustainable network management.","While the patent describes a sophisticated network control mechanism, it doesn’t inherently demonstrate a green technology innovation. The core functionality – conditional disconnection – could simply be a default behavior that, in reality, increases energy consumption through signaling overhead and potential congestion. The argument relies on interpretation and lacks demonstrable evidence of energy reduction, making Y02 an inappropriate classification.",0,"The arguments presented highlight a critical divergence in interpretation. The advocate successfully argued that the dynamic connection management directly addresses energy consumption, aligning with Y02’s focus on efficient communication. However, the skeptic’s concerns regarding potential increased overhead and the lack of demonstrable energy savings are valid. Ultimately, the patent’s description lacks sufficient evidence to definitively classify it under Y02, and a more nuanced assessment of the underlying network protocols and potential for increased energy consumption is warranted."
