doc_id,advocate_argument,skeptic_argument,is_green_tech,judge_rationale
9077098,"Patent Claim 1’s innovative sealant dispensing system demonstrably contributes to environmental protection, durability, and resource efficiency – all core elements of green technology. The system’s automated dispensing drastically reduces material waste compared to manual application, extends product lifecycles by preventing component failure, and encourages the use of environmentally friendly sealant formulations due to precise control. The accessibility of the fill port further enhances sustainability by facilitating maintenance and repair, reducing the need for complete component replacement. This aligns directly with Y02’s focus on protecting equipment and minimizing environmental impact.","While the patent describes a more controlled sealant application method, it doesn’t fundamentally represent a ‘green technology’ advancement within CPC Y02. The arguments rely heavily on implied benefits and a simplistic interpretation of ‘green technology.’ The reduction in waste is predicated on a plausible scenario, not an inherent innovation, and the system still requires sealant. Furthermore, extended product lifecycles aren’t solely attributable to the sealant system, and the system doesn’t force the use of environmentally friendly materials. Alternative classifications, such as Y03 or H01R, are more appropriate given the invention’s core function as a connector.",0,"The arguments presented are largely based on plausible scenarios rather than demonstrable environmental advantages. While the sealant dispensing system offers an improved application method, it doesn’t fundamentally alter the need for sealant or address the underlying environmental concerns of electrical components. The evidence provided – reduced waste, extended lifecycles, and encouragement of greener materials – are all contingent on the system’s performance and user choices, lacking a strong, independent contribution to environmental sustainability as required for Y02 classification."
8782351,"The patent claim describes a method where a virtual guest controls its memory allocation and access, directly reducing VMM-driven migration and consequently minimizing energy consumption. This aligns with Y02’s focus on designing systems for optimal resource utilization and minimizing energy waste, contributing to green computing goals. The ability to restrict memory access fundamentally reduces server migration, a significant energy consumer, and optimizes resource utilization, leading to lower server counts and a reduced carbon footprint.","The advocate’s argument oversimplifies VMM behavior and attributes a causal link where one doesn’t exist. VMMs manage resources proactively, and the guest’s memory control merely alters one input parameter, not eliminating migration. The reduction in energy consumption is a consequence of reduced migration, not a fundamental green technology benefit.  Furthermore, Y02 is too broad, and more precise classifications like Y02K or Y02C are more appropriate.",0,"While the skeptic correctly identifies the potential for reduced migration, the advocate’s argument successfully demonstrates the core innovation lies in the *design* of the system to actively manage resource allocation. The claim’s impact on VMM behavior, while potentially marginal, is significant enough to warrant Y02 classification, aligning with the broader goal of designing computer systems for efficiency and sustainability. The evidence presented, though not empirically validated, supports the claim’s potential to contribute to green technology principles."
8440766,"This patent claim utilizes a multi-stage emulsion polymerization process with a precisely controlled monomer ratio (3:7 to 7:3) to minimize waste and maximize monomer utilization, representing a significant advancement in green technology within the Y02 framework. The staged approach inherently reduces the carbon footprint compared to conventional bulk polymerization and aligns with Y02’s emphasis on resource efficiency and waste reduction.","The claim’s reliance on emulsion polymerization itself is a well-established technique, and the staged approach represents a logical, albeit incremental, optimization rather than a revolutionary green innovation. The assertion of ‘drastic reduction’ in carbon footprint lacks supporting data, and the ‘greenness’ is contingent on the application of the tailored polymer, not inherent in the process itself. A more precise classification within C08 is warranted.",0,"Both arguments highlight valid points. The advocate correctly identifies the potential for waste reduction and resource efficiency inherent in the staged emulsion polymerization process, aligning with Y02’s goals. However, the skeptic’s concerns regarding the incremental nature of the innovation and the lack of concrete evidence supporting a ‘drastic’ reduction in carbon footprint are well-founded. The claim’s core technology – emulsion polymerization – is already established, and the benefits are primarily derived from optimized process control rather than a fundamentally new green technology. Therefore, a classification solely under Y02 is not justified based on the presented arguments."
9761846,"The battery case patent, with its layered design incorporating a reinforcing member and foam, represents a significant advancement in sustainable protective technology. The strategic material utilization minimizes material consumption, potentially enhances energy storage performance through thermal management, and lends itself to the use of recycled/bio-based materials, aligning with core green technology principles and justifying classification under CPC Y02.","The patent’s arguments for Y02 classification are overly reliant on speculative benefits and a superficial interpretation of ‘green technology.’ The claimed material reduction is contingent on material selection, the thermal management benefit is unproven, and the use of recycled/bio-based materials is merely a potential application, not a core innovation. A more appropriate classification would be Y02C 63/00 – Cases and housings for batteries.",0,"The arguments presented are largely balanced, with the advocate successfully highlighting the potential for material optimization and indirect benefits related to thermal management. However, the skeptic’s critique regarding the speculative nature of the claimed advantages and the lack of specific material specifications significantly undermines the justification for Y02 classification. The patent’s core innovation appears to be primarily a layered design, and the potential green benefits are contingent on factors not explicitly addressed within the claim itself, leading to a determination that Y02 is not the most appropriate classification."
9663560,"I firmly believe that Claim 1, describing the nucleic acid construct utilizing a portion of the *Gossypium hirsutum* PHYA1 gene to generate an RNAi molecule, *must* be classified under CPC Y02 – “Methods of Genetic Modification for Agricultural Purposes.” My rationale rests on the core principles of this classification and the profound, environmentally beneficial implications of this specific technology. This claim directly falls within this scope. The creation of an RNAi molecule targeting PHYA1 is a prime example of a precision gene silencing technique – a cornerstone of modern, sustainable agricultural innovation. Specifically, the technology reduces pesticide use, minimizes ecosystem disruption, and contributes to enhanced crop resilience, aligning perfectly with the Y02 goal of creating more sustainable and efficient agricultural systems.","While the advocate’s argument for classifying Claim 1 under CPC Y02 possesses a superficially appealing narrative of ‘green technology,’ a critical examination reveals significant weaknesses and a potentially overly broad interpretation of the classification. The argument relies heavily on framing RNAi as a benign ‘modulation’ technique, obscuring the inherent risks and uncertainties associated with manipulating gene expression, particularly through RNAi in a complex biological system. Furthermore, the emphasis on ‘reducing pesticide use’ is a simplistic justification that doesn’t fully account for the broader environmental implications of introducing a novel genetic construct into the environment. The classification of this patent under Y02 is a misapplication of the classification’s intent. A more accurate and nuanced approach would recognize the fundamental nature of this technology as a method of nucleic acid analysis, rather than a broad category of agricultural genetic modification.",0,"The arguments presented highlight a fundamental disagreement regarding the scope of CPC Y02. The advocate successfully argues for the technology's potential to reduce pesticide use and contribute to sustainable agricultural practices, aligning with the classification's core objectives. However, the skeptic effectively counters this by emphasizing the inherent uncertainties and risks associated with RNAi technology, particularly its potential for off-target effects and the lack of comprehensive understanding of its long-term ecological consequences. Based on the presented evidence, the claim's focus on gene silencing rather than direct crop improvement, coupled with the significant uncertainties surrounding RNAi's efficacy and safety, leads to a determination that Y02 is not the most appropriate classification."
8985451,"The patent claim describes a communication apparatus designed for efficient wireless transmission, minimizing energy waste through optimized protocols like timeout periods and retransmission logic. The IC card interaction and error handling further contribute to a streamlined, energy-conscious process. This aligns perfectly with Y02’s core focus on optimizing resource utilization, including energy, and has the potential to significantly reduce the carbon footprint associated with wireless networks through a more sustainable communication method.","The claim’s features – timeout periods, retransmission logic, and error handling – are standard elements of robust wireless communication protocols, not inherently ‘green’ technologies. The argument overstates the energy reduction potential and relies on speculative future innovations. A more accurate classification would be Y02C7/04, reflecting the core function of the invention, and lacks concrete evidence of significant environmental benefits.",0,"Both arguments present valid points. The advocate correctly identifies the core functionality of the claim – optimized wireless transmission – but fails to adequately demonstrate a substantial green technology contribution. The skeptic accurately points out that the described features are standard in wireless communication and that the argument relies heavily on speculation. Therefore, based on the presented arguments, the claim does not meet the criteria for classification under CPC Y02 as a core green technology innovation, and a more specific classification within Y02C is more appropriate."
8931502,"The gas-dispensing device, with its sequential dispensing and emergency discharge system, represents a significant green technology advancement by minimizing gas waste, proactively mitigating environmental hazards, and prioritizing user safety. The device’s design inherently considers responsible decommissioning, and its potential for integration with renewable energy systems further enhances its sustainability profile, justifying classification under CPC Y02.","The claimed features – sequential dispensing and an emergency discharge system – are largely incremental improvements to existing gas dispensing technology and primarily address known hazards. The device doesn’t demonstrate a significantly different or more efficient dispensing method, and the emergency discharge system is a reactive safety measure rather than a novel green innovation. The arguments for Y02 classification rely on speculative benefits and fail to demonstrate a fundamentally novel contribution to environmental protection.",0,"The arguments presented are largely based on interpretation and extrapolation rather than demonstrable innovation. While the emergency discharge system offers a safety benefit, the core functionality – sequential dispensing – is readily achievable with existing technology. The evidence provided does not sufficiently establish a novel contribution to environmental protection to warrant classification under CPC Y02, and alternative classifications (Y02E or G05D) are more appropriate given the device’s primary function."
8907527,"This contactless power-feed equipment patent should be classified under CPC Y02 – “Electrical Power Transmission.” The patent describes a highly efficient, low-loss method of wirelessly transferring electrical energy using resonant inductive power transfer. This directly aligns with the principles of green technology and sustainable energy solutions championed by Y02. The system’s core innovation – minimizing energy losses and eliminating wired infrastructure – represents a significant advancement in power delivery, directly supporting the goals of Y02 and contributing to reduced greenhouse gas emissions and a smaller environmental footprint.","While the patent describes a resonant inductive power transfer system, the overwhelming emphasis on complex control circuitry – Zener diodes, transistors, switching elements, and a DC choke – indicates a focus on *regulating* and *controlling* the power transfer, rather than the fundamental act of transmitting power over a distance. The localized application to a movable body or device, coupled with the redundancy of the control system, suggests a deviation from the broader scope of Y02, which typically covers long-distance power transmission grids. The system’s primary function is a sophisticated DC-DC converter with resonant characteristics, not a fundamental advancement in transmission.",1,"The arguments presented highlight a key distinction: the patent’s core innovation lies in the sophisticated control and regulation of a resonant inductive power transfer system, rather than the fundamental transmission of electrical energy over a distance. While the system utilizes principles aligned with Y02, the extensive control circuitry and localized application limit its scope. Therefore, a classification under Y02 is justified based on the system’s overall functionality as a highly efficient power transfer solution, despite the complex control elements."
8990464,"This patent claim describes a method for coordinating data communications in a series of devices using synchronization, which inherently reduces energy consumption by minimizing unnecessary polling and reactive behavior. The periodic synchronization frame establishes a precise timing framework, allowing devices to only transmit and receive data during designated intervals, drastically reducing ‘idle listening’ – a major energy drain. This method is directly aligned with CPC Y02’s focus on data communication and synchronization, offering a significant contribution to green technology by optimizing resource utilization and minimizing energy waste across the entire communication system.","The patent’s reliance on synchronization introduces a new energy consumption element – the periodic transmission of the synchronization control frame itself. The ‘selective forwarding’ mechanism adds significant processing overhead to each slave device, creating a constant state of readiness and ‘idle listening.’ While the advocate claims optimization mitigates this, optimization requires energy. Furthermore, the complexity of the system – series of transmissions, selective forwarding, and data manipulation – increases overall computational load and energy consumption. CPC Y02 is too broad, and more specific classifications like Y02C or Y02E would be more appropriate.",0,"The arguments presented highlight a fundamental tension: while synchronization can reduce energy consumption in certain scenarios, the patent’s implementation introduces new energy demands through the synchronization frame and processing overhead. The complexity of the system, coupled with the broad scope of CPC Y02, makes it an insufficient classification. The evidence presented by both sides suggests that the patent’s contribution to green technology is not definitively established, and a more nuanced classification is warranted."
8345657,"The patent claim describes a method for optimizing data transmission in a wireless network by utilizing a Transmission Time Interval (TTI) to manage data packets, reducing energy consumption and aligning with the goals of green wireless networks. The component header and data chunking further streamline transmission, minimizing overhead and contributing to energy efficiency.","The claim’s core technique – TTI-based scheduling – is a baseline optimization already present in existing wireless protocols like 802.11 and LTE. The added complexity of sub-headers and component numbers could potentially increase energy consumption, and the claim lacks evidence demonstrating a net reduction in energy usage.  Alternative classifications under Y02K or Y02C are more appropriate.",0,"Both arguments highlight valid points. The skeptic correctly identifies that TTI-based scheduling is a common, established technique. However, the advocate’s emphasis on the specific implementation – the sub-header generation and component data chunking – does introduce a degree of optimization that could, in theory, reduce overhead.  Ultimately, the claim lacks a strong, demonstrable innovation that justifies classification under Y02, particularly considering the skeptic’s concerns about potential increased complexity and the absence of compelling evidence of energy savings. Therefore, a classification under a more general data processing category is more appropriate."
8795462,"The patent claim describes a novel process for forming a transparent conductive coating using a liquid emulsion with controlled nanoparticle evaporation, significantly reducing solvent use and VOC emissions compared to traditional methods. The use of nanoparticles enhances performance and material efficiency, aligning with Y02’s focus on coating production and promoting a more sustainable approach to coatings technology, including a beneficial increase in light transmission.","While the process may reduce solvent use compared to traditional methods, it relies on assumptions about solvent selection and doesn’t address the significant environmental impacts of nanoparticle production, potential leaching, or the long-term durability and disposal of the coating. A broader classification considering material safety and lifecycle analysis is more appropriate, potentially falling under H01M or H01J, and C09D or B32 would be more suitable starting points.",0,"The advocate’s argument successfully highlights the potential for reduced solvent use and VOC emissions through the emulsion-based process and nanoparticle utilization, aligning with Y02’s scope. However, the skeptic’s concerns regarding nanoparticle sourcing, potential leaching, and the long-term durability of the coating are valid and demonstrate a critical need for a more comprehensive assessment. The patent’s classification under Y02 is ultimately too broad, failing to adequately address the significant environmental considerations associated with the technology’s lifecycle, therefore a classification under C09D is more appropriate."
8354336,"Claim 1’s focus on corrosion prevention through a novel protective layer firmly places it within the scope of CPC Y02. The technology offers substantial environmental benefits regarding material consumption, waste reduction, and the minimization of hazardous byproduct release, aligning perfectly with Y02’s goals of extending material service life and reducing environmental impact. The nanopore technology and use of a potentially sustainable surface active compound further enhance its green credentials.","The claim’s approach – applying a thin layer *after* initial degradation has begun – represents damage control, not fundamental corrosion prevention. The reliance on a narrow thickness range (0.5nm - 5nm) for the protective layer and the potential for hazardous byproducts from the surface active compound undermine the argument for Y02 classification. A classification under Y02C, concerning the fabrication of conductive coatings, is more appropriate.",0,"The evidence presented suggests a nuanced position. While the patent addresses a relevant environmental concern (corrosion), the core innovation – a post-corrosion protective layer – leans more towards damage mitigation than proactive corrosion prevention, a key element of Y02. The significant uncertainties surrounding the surface active compound’s composition and the limited thickness range weaken the argument for Y02 classification, favoring the more targeted scope of Y02C for conductive coatings."
8946906,"The multilayer wiring substrate, through its design featuring via holes and conductors, inherently reduces material consumption and enables higher density electronics, directly contributing to energy efficiency and supporting key green technologies like EVs, renewable energy systems, and LED lighting. This aligns perfectly with the core principles of CPC Y02 – optimizing material use and facilitating smaller, more efficient electronic systems, ultimately minimizing the environmental footprint of electronics. The substrate’s design is a foundational element in enabling a more sustainable electronics industry.","While the substrate’s design may contribute to efficiency gains, the Advocate’s argument for Y02 classification as inherently ‘green technology’ is fundamentally flawed. The claim hinges on potential benefits without adequately addressing the significant environmental burdens associated with material production – the epoxy resins, copper, and specialized polymers – and the energy-intensive process of via hole manufacturing. The argument relies on technological determinism and a circular economy narrative without a robust lifecycle assessment or consideration of alternative PCB technologies.",0,"Both arguments present valid points. The Advocate’s emphasis on material reduction and enabling efficient technologies is compelling, aligning with Y02’s goals. However, the Skeptic’s concerns regarding the significant environmental impact of material production and the energy-intensive manufacturing processes, particularly via hole creation, are equally valid. The evidence presented by both sides is insufficient to definitively classify this patent under Y02, as the potential benefits are contingent on sustainable material choices and manufacturing processes that are not explicitly addressed in the claim itself. Therefore, a more detailed investigation into the substrate’s production and lifecycle would be required before a final classification decision can be made."
8729541,"The patent claim, centered around the creation of a specific phenanthrene compound with defined variations, is fundamentally a green technology innovation. Its potential applications within sustainable technologies, coupled with the emphasis on process optimization and reduced environmental impact, unequivocally supports classification under CPC Y02. It’s a step towards developing more sustainable materials and processes – a core objective of this classification system. The creation of a novel chemical entity, even without explicitly detailed synthesis, aligns with Y02’s focus on reducing environmental impact through material science and chemical synthesis. The variations in ‘R’ suggest an iterative process of optimization, a key element of Y02, and the potential applications – organic electronics, advanced materials, catalysis – demonstrate a clear pathway towards sustainable technologies.","I find the advocate’s arguments overly reliant on potential and lacking sufficient grounding in the actual claims. While the *possibility* of green benefits exists, the classification under Y02 is premature and potentially misleading. The claim’s vagueness – a general formula and a range of ‘R’ substituents – lacks the detail necessary to assess a ‘novel process’ within Y02. Simply stating the creation of a ‘specific’ phenanthrene derivative doesn’t constitute innovation. Phenanthrene itself is a naturally occurring PAH, and the patent doesn’t demonstrate a departure from this established source. The speculative applications – organic electronics, advanced materials, catalysis – don’t guarantee green benefits, and the argument risks greenwashing without concrete process details.",0,"Both arguments highlight valid points. The advocate correctly emphasizes the potential for innovation and sustainability inherent in novel material synthesis. However, the skeptic’s concerns regarding the claim’s vagueness and the reliance on speculative applications are well-founded. The lack of specific process details prevents a definitive assessment of whether the invention genuinely reduces environmental impact, a core requirement for Y02 classification. Therefore, based on the current information, a classification under Y02 is not justified."
