doc_id,advocate_argument,skeptic_argument,is_green_tech,judge_rationale
9194242,"This patent claim, utilizing a CMAS-resistant thermal barrier coating on a superalloy substrate, represents a significant green technology advancement. The extended lifespan of the superalloy directly reduces the need for new alloy production, a highly energy-intensive process, thereby lowering carbon emissions and fossil fuel consumption. The improved energy efficiency of the system, achieved through reduced heat loss, further minimizes energy demand and aligns perfectly with the core principles of CPC Y02, which focuses on reducing the environmental impact of energy generation and utilization.","The advocate’s argument relies heavily on speculative projections of reduced fossil fuel consumption and carbon emissions, without sufficient granular data or demonstrable proof. The energy required to produce the superalloy substrate remains a fixed cost, regardless of component lifespan extension. Furthermore, the claim of improved energy efficiency needs rigorous validation, as the magnitude of heat loss reduction depends on specific operating conditions, and the CMAS material itself may have its own environmental burdens requiring lifecycle analysis.",0,"While the patent’s contribution to component longevity and potentially reduced maintenance is acknowledged, the argument for Y02 classification based solely on extrapolated environmental benefits is ultimately unconvincing. The core issue is the lack of concrete data demonstrating a quantifiable reduction in energy consumption or emissions directly attributable to the CMAS-resistant TBC. The speculative nature of the benefits, coupled with the inherent energy intensity of superalloy production, outweighs the arguments for Y02 classification. A more targeted classification within Y02C (protective coatings for metals) would be more appropriate."
9062723,"The parallel double-clutch device offers significant green technology benefits due to enhanced fuel efficiency, optimized engine operation, and potential for integration with hybrid vehicles. The core functionality – minimizing torque interruption during gear changes – directly addresses the Y02 category’s focus on drivetrain efficiency, a cornerstone of sustainable transportation. The device’s rapid shifts reduce wasted energy, lower greenhouse gas emissions, and contribute to smoother engine operation, aligning perfectly with the category’s goals.","While a PDC can offer efficiency gains, the advocate’s argument overstates its green credentials. The manufacturing complexity of a parallel PDC, involving rare earth metals and high-precision components, generates significant upstream environmental impacts. Furthermore, the claimed benefits – reduced thermal emissions and hybrid integration – are secondary consequences, not core features, and the broader scope of Y02 is too expansive for this specialized device. A more targeted classification is warranted.",1,"Based on the arguments presented, the patent claim demonstrates a clear link between the parallel double-clutch device and enhanced drivetrain efficiency, a key element of CPC Y02. While the skeptic raises valid concerns about the manufacturing impact, the advocate’s emphasis on fuel reduction and optimized engine operation, coupled with the potential for hybrid integration, strongly supports classification under Y02. The judge will require further investigation into the manufacturing process to fully assess the environmental impact, but the core innovation aligns with the category’s objectives."
8373198,"This patent describes a TFT substrate with potential for energy-efficient operation and sustainable materials. The layering, contact hole design, and possibility of solution-processable materials align strongly with CPC Y02’s focus on minimizing power consumption, reducing waste, and promoting environmentally friendly semiconductor manufacturing processes. The technology inherently contributes to green technology advancements within the Y02 field.","The patent’s claim lacks material specifications and crucially includes photolithographic features, which are inherently wasteful and environmentally damaging. The argument for ‘green’ materials is speculative and doesn’t justify classification under Y02, which focuses on semiconductor devices, not necessarily sustainable materials. Alternative classifications like Y30 or Y32 are more appropriate.",0,"The arguments presented highlight a key tension: the patent’s description offers *potential* for green technology, but the claim itself lacks concrete details regarding environmentally beneficial materials or processes. The inclusion of photolithography, a known source of waste and hazardous chemicals, significantly weakens the case for Y02 classification. While the patent’s design could be implemented in a sustainable manner, the current claim does not demonstrate that, and therefore, a more targeted classification is warranted."
8975941,"The patent claim describes a CMOS bridge rectifier circuit with a ‘representative output signal,’ which is fundamentally a signal processing operation. This circuit’s potential integration into energy harvesting systems, particularly utilizing renewable sources, represents a significant contribution to green technology and warrants classification under CPC Y02. The focus on intelligent data acquisition and control, facilitated by the ‘representative output signal,’ further strengthens the argument for Y02.","The claim’s description of a standard CMOS bridge rectifier circuit with a ‘representative output signal’ represents a broad and arguably inappropriate interpretation of ‘signal processing.’ The core function remains rectification, and the ‘representative output signal’ is merely a measurement of the rectified voltage. The potential for energy harvesting integration is a secondary justification, not a core characteristic of the invention itself. The claim lacks novelty in circuit design and speculative projections of ‘smart monitoring & control’ do not justify Y02 classification.",0,"While the advocate’s emphasis on energy harvesting and intelligent monitoring is understandable, the core argument relies on a generous interpretation of ‘signal processing’ applied to a fundamentally passive rectification circuit. The claim’s description lacks specific innovations in circuit design or performance, and the ‘representative output signal’ primarily serves as a measurement. Therefore, based on the presented arguments and evidence, a classification under CPC Y02 is not warranted, and a more appropriate classification within Y02C is recommended."
8372743,"The patent claim, utilizing dipole illumination for selective photolithography, represents a strategically applied green technology solution. The reduction in material consumption, energy efficiency, improved yield, and overall contribution to a sustainable manufacturing process unequivocally support classification under CPC Y02.","The Advocate’s argument hinges on a highly specific interpretation of ‘green technology’ and overstates the significance of dipole illumination in this context. The claim lacks concrete data to substantiate assertions regarding reduced material consumption and energy efficiency, and the three distinct photolithography processes are a common, rather than innovative, fabrication technique.",0,"The arguments presented by both the advocate and skeptic highlight significant weaknesses in the claim’s justification for Y02 classification. While the use of dipole illumination may offer potential benefits, the claim lacks empirical evidence to demonstrate a substantial reduction in material consumption or energy efficiency, and the reliance on three distinct photolithography processes is a standard practice rather than a novel innovation. Therefore, based on the available information, a classification under Y02 is not warranted."
9034193,"Patent Claim 1 represents a significant advancement in sustainable water treatment. The system’s demand-driven chemical delivery, individual packet system, automated operation, and environmental protection features align strongly with the core principles of CPC Y02, minimizing chemical waste, optimizing resource utilization, and promoting dynamic optimization of water treatment processes. The system’s real-time response to bather load and proactive measures like the water barrier film demonstrate a commitment to sustainable water management.","While the system incorporates some innovative elements, the ‘packet disruption mechanism’ and reliance on bather load introduce significant drawbacks. The system generates substantial plastic waste through its packet disruption process, and the inherent instability of chemicals within the water barrier film raises concerns about degradation and potential for increased chemical usage. Furthermore, the system’s sensitivity to fluctuating bather load introduces complexity and potential for misuse, undermining the goal of optimized treatment.",0,"The arguments presented highlight a critical trade-off: while the system offers precision chemical delivery, the mechanical disruption of packets and the inherent instability of the chemical delivery system introduce new waste streams and potential for increased chemical usage. The evidence presented by both sides suggests that the system’s sustainability benefits are not unequivocally established, and therefore, a classification under Y02 is not warranted based on the current information."
9128582,"The smartpad’s design, utilizing a ‘card stack’ to display only active application windows, represents a strategic innovation for optimizing resource utilization and reducing environmental impact. This system inherently minimizes energy consumption by reducing the power draw of inactive displays, improves application efficiency, and reduces digital waste through a more conscious user interface. The intentional design directly aligns with the core principles of CPC Y02, demonstrating a proactive approach to sustainable computing.","The patent’s claim of ‘green technology’ is overstated and lacks sufficient evidence. The ‘card stack’ is a common UI pattern, and the argument relies heavily on user behavior to achieve energy savings. Furthermore, the claim provides no quantifiable data on energy reduction, ignores the environmental impact of manufacturing and end-of-life, and fails to address broader sustainability concerns. A classification under Y02 is unwarranted due to the speculative nature of the benefits and the absence of demonstrable environmental impact.",0,"Both the advocate and skeptic raise valid points. The advocate’s argument relies heavily on interpretation and lacks concrete evidence to support a significant environmental benefit. The skeptic correctly identifies the ‘card stack’ as a common UI pattern and highlights the lack of quantifiable data. While the smartpad’s design *could* contribute to energy savings, the claim of it being a core ‘green technology’ based solely on this UI element is not sufficiently substantiated under the criteria of CPC Y02. Therefore, a classification under Y02 is not justified at this time."
8536153,"The patent claim, defined by formula (I), represents a novel compound and, therefore, a process related to chemical substances. This inherently aligns with CPC Y02, which covers processes related to chemical substances. The inclusion of ‘R and R…’ suggests a deliberate synthesis and optimization, reflecting core green chemistry principles of minimizing hazardous substances and maximizing efficiency. Potential applications, such as utilizing the compound as a precursor to renewable materials or reducing toxicity, further strengthen the argument for Y02 classification, incentivizing sustainable chemical production.","The argument that a defined chemical formula automatically implies a novel process is overly simplistic and potentially misleading. The claim merely describes a molecule; it provides no information about the synthesis route, reagents, or conditions employed. Relying on hypothetical green chemistry applications – such as renewable materials or reduced toxicity – is speculative and doesn’t justify a broad Y02 classification. More precise classifications within C11/D (Chemical Analysis) and C23/D (Organic Chemistry) are more appropriate, reflecting the potential focus on compound characterization or synthesis, respectively.",0,"Both arguments present valid points. The advocate correctly identifies the potential for innovation within Y02 based on the compound's definition and the possibility of green chemistry applications. However, the skeptic’s critique regarding the ambiguity of the claim – solely a chemical formula – is crucial. Without specific details regarding the synthesis process and intended application, classifying solely under Y02 is too broad. The inherent lack of process information weakens the justification for Y02, and alternative classifications offer greater precision. Therefore, a classification of 0 is warranted."
8709559,"This patent claim (Claim 1) strongly advocates for classification under CPC Y02 – ‘Packaging, comprising a film or sheet’ – due to the innovative use of biodegradable and bio-based materials. The claim’s focus on a substantially biodegradable substrate, a copolymer of lactic acid and caprolactone, and optimized optical properties (low haze) represents a significant advancement in sustainable packaging, aligning directly with Y02’s goal of minimizing waste and reducing environmental impact. The peelable design further contributes to a circular economy, enhancing the overall sustainability of the packaging solution.","While acknowledging the potential for bio-based materials, the claim’s classification under Y02 is overly broad and misleading. The ‘substantially biodegradable’ designation lacks specific biodegradability requirements, and the copolymer’s actual degradation characteristics are uncertain. Furthermore, the peelable design introduces a significant waste stream, undermining the purported sustainability benefits. A more targeted classification within Y02C or Y02E, coupled with specific requirements for demonstrable biodegradability testing, is more appropriate.",1,"The evidence presented supports classification under Y02. The core innovation lies in the packaging material itself – a biodegradable film utilizing bio-based polymers – which directly addresses the environmental concerns associated with traditional plastic packaging. While the skeptic raises valid concerns regarding the stringent conditions required for actual biodegradability and the potential for waste generation from the peelable design, the advocate’s arguments regarding the material’s composition and intended function are sufficiently strong to warrant Y02 classification. Further investigation into the specific degradation characteristics would be a standard part of the examination process."
9736829,"The patent claim describes a method for wireless communication that intelligently utilizes shared spectrum based on Clear Channel Assessment (CCA) results. This approach directly addresses spectrum congestion, reduces energy consumption by dynamically selecting the most efficient carrier, and promotes sustainable spectrum management. Classifying this under CPC Y02 is appropriate because it falls squarely within the scope of methods for radio communication, and the core innovation – adaptive spectrum utilization – is a key element of green technology, minimizing waste and maximizing resource efficiency.","While the claim describes an adaptive communication method, classifying it solely under CPC Y02 oversimplifies the invention and risks misrepresenting its environmental benefits. The core functionality – monitoring a carrier and reacting to CCA results – is fundamentally an adaptive control mechanism, not a revolutionary green technology. Alternative classifications within Y02E (Adaptive Control) or G01S (Navigation & Detection) more accurately reflect the underlying technology and the need for rigorous data to substantiate the ‘green’ claims. The emphasis on ‘reducing congestion’ is a consequence of existing spectrum inefficiencies, not a fundamental solution.",0,"The arguments presented highlight a critical divergence in interpretation. The advocate successfully argues for Y02 based on the core concept of adaptive spectrum utilization, framing it as a key element of sustainable wireless communication. However, the skeptic raises valid concerns regarding the oversimplification of the technology and the lack of robust evidence to support the ‘green’ claims. Given the reliance on CCA and the potential for significant energy consumption within that process, a more targeted classification within Y02E or G01S, coupled with further data analysis, would be more appropriate to accurately reflect the patent’s scope and potential environmental impact."
8981404,"The patent claim describes a novel optoelectronic chip featuring a diffusion barrier with apertures designed to minimize metal diffusion and waste during semiconductor fabrication. This directly aligns with Y02’s focus on efficient material utilization and reduced waste streams, representing a tangible advancement in green semiconductor technology. The apertures enhance process control and potentially reduce chemical usage, further contributing to a cleaner manufacturing process and a sustainable future.","While the patent describes a complex design with a diffusion barrier, the claimed environmental benefits are speculative. The claim doesn’t definitively demonstrate that uncontrolled metal diffusion was a significant problem in existing manufacturing processes, and the barrier’s effectiveness hinges on the chip’s performance characteristics. The apertures introduce new potential sources of contamination and require further processing steps, potentially negating any material savings. A broader Y02 classification overstates the innovation’s green credentials and obscures significant engineering challenges.",0,"The Advocate’s argument is compelling in highlighting the potential for reduced material waste through the diffusion barrier, aligning with Y02’s core principles. However, the Skeptic’s concerns regarding the lack of concrete evidence demonstrating the severity of the diffusion problem and the potential for increased complexity and contamination are valid. The claim’s reliance on speculative benefits outweighs the strength of the argument for Y02 classification, particularly given the absence of demonstrable data on performance improvements and waste reduction."
8524866,"The patent claim describes an antibody or fragment that specifically binds to a defined peptide sequence, utilizing bioproduction techniques (primarily plant-based cell culture) which inherently reduces reliance on animal-derived materials, minimizes greenhouse gas emissions, and mitigates zoonotic disease risks. This aligns directly with Y02’s focus on precise detection and analysis, and the use of plant-based systems represents a significant green technology advancement. The claim’s specificity (90-100% sequence identity) further underscores the technological innovation focused on targeted biological analysis, and the potential applications – early disease detection and point-of-care diagnostics – contribute to a sustainable outcome.","The claim’s focus is on the detection of a specific peptide sequence, not the bioproduction methodology. CPC Y02 primarily concerns the detection and analysis of substances, including biological materials. The ‘bioproduction’ aspect is presented as an advantage, but the claim doesn’t dictate *how* the antibody was produced. Plant-based systems are not inherently ‘green’ and their sustainability depends on specific cultivation practices and waste management strategies. The argument that the precision afforded by the antibody reduces waste generation is speculative and dependent on implementation.",1,"The evidence presented by both the advocate and skeptic highlights a key tension within the claim: the emphasis on bioproduction versus the core function of precise detection. While the advocate’s argument correctly identifies the potential for plant-based bioproduction to reduce environmental impact, the skeptic’s points regarding the lack of inherent greenness and the speculative nature of waste reduction are valid concerns. Ultimately, the claim’s focus on a highly specific antibody binding event, aligning with Y02’s definition of precise detection, outweighs the production methodology, justifying classification under Y02."
9698336,"The invention describes a novel method for producing a cellulose-zinc oxide nanocomposite utilizing renewable cellulose, controlled nanoparticle synthesis via a ‘seed’ approach, and minimized solvent usage. This aligns with green technology principles by reducing reliance on petroleum-based materials, minimizing hazardous synthesis conditions, and promoting a more sustainable material with potential applications in bio-based coatings, water filtration, and sustainable packaging. Therefore, classification under CPC Y02 – ‘Production of inorganic non-metallic materials’ – is justified due to the core innovation of creating a nanocomposite with inherent green technology advantages.","While the invention incorporates cellulose, the core innovation lies in the controlled synthesis of zinc oxide nanoparticles using a ‘seed’ approach. The method still relies on organic solvents and, despite efforts to minimize usage, the inherent environmental risks associated with nanoparticle production are not adequately addressed. Classifying solely under Y02 risks overstating the green technology aspects and obscures the potential for environmental concerns related to nanoparticle synthesis. Alternative classifications focusing on polymer modification or composite materials would be more appropriate.",1,"The arguments presented highlight a crucial distinction: the primary innovation is the controlled synthesis of zinc oxide nanoparticles within a cellulose matrix. While the advocate correctly identifies the use of renewable resources and efforts to minimize solvent usage, the skeptic’s concerns regarding the inherent environmental risks of nanoparticle production are valid. Based on the evidence presented, the method represents a step forward in material science with a focus on sustainability, justifying classification under CPC Y02."
9564501,"The patent claim, describing a transistor structure formed on a substrate, aligns directly with CPC Y02’s core focus on sustainable electronics and material efficiency. The inherent potential for innovation in material optimization, miniaturization, and process techniques – particularly regarding reduced waste and energy consumption – firmly places this invention within the scope of Y02’s objectives. The claim’s breadth allows for consideration of the entire device lifecycle, encompassing manufacturing impacts, material sourcing, and end-of-life management, all critical aspects of Y02 classification.","The claim is excessively broad and lacks specific details regarding the transistor’s design or fabrication process. The term ‘transistor structure’ is generic and could encompass any standard transistor technology. Without further specification, it’s difficult to argue that this invention represents a significant advancement in sustainable electronics as defined by CPC Y02, which typically requires demonstrable innovation in materials, processes, or energy efficiency.",1,"The advocate’s argument successfully highlights the potential for innovation inherent in the claim’s description, emphasizing the focus on material optimization and process improvements – key drivers of sustainability within CPC Y02. While the skeptic’s concern regarding the claim’s generality is valid, the advocate’s response effectively demonstrates that the claim’s breadth allows for the incorporation of novel techniques and materials, aligning with Y02’s broader objectives of promoting environmentally conscious electronic device design and manufacturing."
