doc_id,advocate_argument,skeptic_argument,is_green_tech,judge_rationale
8466222,"This rubber composition patent represents a significant step forward in sustainable rubber technology. By strategically reducing carbon black dependency, utilizing a carefully selected range of sustainable inorganic fillers, and optimizing natural rubber content with epoxidation, the patent delivers enhanced performance characteristics while dramatically minimizing the environmental footprint compared to traditional rubber formulations. The increased product lifespan further amplifies the green benefits, aligning perfectly with the goals of CPC Y02 and promoting a more circular economy within the rubber industry.","The patent’s claims of a ‘green technology’ innovation are overstated and lack sufficient scientific backing. While reducing carbon black is a positive step, it’s largely driven by regulatory pressure and doesn’t represent a revolutionary shift. The use of ‘sustainable’ fillers is a qualified term, as their extraction and processing also carry significant environmental burdens. The claim of extended product lifespan is a marginal benefit, and the suggestion of a circular economy is speculative without concrete evidence. A more accurate classification would focus on the core inventive step – improved rubber composition – rather than promoting a misleading ‘green’ narrative.",0,"This patent demonstrates a modest improvement in rubber composition performance through the strategic use of fillers and natural rubber. However, the skeptic’s arguments regarding the inherent environmental impacts of mineral extraction, the limited scope of carbon black reduction, and the speculative nature of the circular economy claims outweigh the advocate’s assertions. While the patent touches upon sustainable materials, the core innovation is primarily focused on enhancing wear resistance and durability, not a transformative green technology. Therefore, classification under CPC Y02 is appropriate but with a cautious interpretation of the environmental benefits."
9233326,"Patent Claim 1 describes a multiphase separation device utilizing a cyclone separator, which is inherently low energy and minimizes waste generation. The inclusion of contouring on the discharge pipe further enhances efficiency and contributes to a more sustainable process, aligning the device squarely within the scope of CPC Y02 and representing a valuable green technology innovation with applications across key industries striving for sustainability.","The device’s core technology – cyclone separation – is a mature and widely used method with minimal inherent green advantages. The claims of low energy consumption and waste minimization are generic outcomes of density-based separation and lack specific performance data. The contouring feature is a marginal optimization with questionable green impact, and the device’s applications are common across various industries, not a unique solution for sustainability. Therefore, Y02 classification is overly generous and misrepresents the device’s technological contribution.",0,"Both the advocate and skeptic raise valid points. The advocate’s emphasis on the cyclone’s low energy consumption and waste minimization is accurate but lacks quantifiable data to support a significant green advantage. The skeptic correctly highlights the maturity of cyclone separation and the marginal benefit of the contouring feature. While the device performs a separation function, the arguments presented do not sufficiently demonstrate a novel or transformative contribution to environmental sustainability under CPC Y02, leading to a rejection of the classification."
9533053,"This patent claim represents a significant advancement in ophthalmic drug delivery, incorporating key green technology principles. The formulation’s reduced reliance on volatile organic solvents (VOCs) during manufacturing and patient use directly contributes to improved air quality and reduced waste generation. The strategic selection of cyclodextrins dramatically enhances olopatadine solubility without the need for large quantities of solvents, minimizing API dosage and potential environmental contamination. The use of biodegradable PEG and PVP further supports a sustainable approach to pharmaceutical formulation.","While the formulation reduces VOCs compared to traditional solutions, the claim overstates the ‘green’ aspects. The use of PEG, even at a lower molecular weight, relies on petrochemical feedstocks and generates significant carbon emissions during its production. The cyclodextrin selection, while sophisticated, doesn’t inherently reduce environmental impact; the production of cyclodextrins themselves is energy-intensive. Furthermore, the biodegradability of PEG is not definitively established and the potential for PEG fragments to persist in the environment remains a concern. The overall environmental impact requires a comprehensive lifecycle assessment, which is not addressed in the claim.",0,"The advocate’s argument relies heavily on the reduction of VOCs and the use of cyclodextrins, which are valid points. However, the skeptic’s concerns regarding the environmental footprint of PEG production and the lack of a comprehensive lifecycle assessment are crucial. The claim lacks sufficient evidence to definitively classify the formulation as a ‘green’ technology, and the potential environmental risks associated with PEG and cyclodextrin production outweigh the limited benefits presented. Therefore, a classification under Y02 is not justified based on the presented arguments."
8808921,"The patent claim describes a novel current collector design for flexible electrodes that directly contributes to green technology by enabling flexible energy storage solutions, optimizing material usage, and enhancing performance through surface modification. The focus on a flat boundary surface and protrusions/grooves aligns with Y02’s goals of efficient and durable energy storage, particularly in the context of emerging technologies like solid-state batteries.","The claim’s core concept of a flexible electrode current collector is not fundamentally novel, and the Y02 classification is overly broad. The specific design features – flat boundary surface and surface modifications – represent incremental improvements rather than a breakthrough. Furthermore, the connection to ‘green technology’ is based on assumptions about improved performance, without addressing critical sustainability aspects like material sourcing or lifecycle assessment.",0,"The arguments presented highlight a reasonable degree of disagreement. While the advocate persuasively argues for the claim’s relevance to flexible energy storage and its potential for green technology applications, the skeptic raises valid concerns regarding the lack of fundamental innovation and the broad scope of Y02. The evidence provided – the specific design features and the reliance on performance improvements – does not sufficiently demonstrate a strong connection to the core objectives of Y02, particularly considering the existing landscape of flexible electrode technologies. Therefore, a classification under Y02 is not definitively supported by the presented arguments."
8478684,"Patent Claim 1 describes a sophisticated computer-implemented method for dynamically optimizing a fuel supply chain. The system’s real-time monitoring of customer purchases and exercise behavior, combined with adjustments to the strike price and premium, directly aligns with CPC Y02’s focus on optimizing supply chains and logistics through data-driven decision-making. The system’s ability to reduce volatile demand and mitigate waste inherently contributes to sustainable resource utilization, a core principle of green technology.","The patent’s core mechanism – manipulating customer behavior through dynamic pricing – is fundamentally misclassified under CPC Y02. The ‘arbitrarily set’ strike price and the system’s feedback loop create a potential for market manipulation, rather than genuine supply chain optimization. The focus on data-driven adjustments is more accurately represented by CPC F23D, which deals with pricing strategies, not broader supply chain logistics.",0,"The arguments presented highlight a key distinction in the classification criteria. While the advocate correctly identifies the system’s data-driven approach, the skeptic’s concerns regarding market manipulation and the arbitrary nature of the strike price significantly weaken the claim’s alignment with Y02’s emphasis on genuine supply chain optimization. The evidence suggests a greater fit with F23D, which is more appropriately suited to classifying pricing methodologies, regardless of their potential impact on sustainability."
9266075,"The patent claim describes a vehicle exhaust system utilizing a mixer with a strategically designed baffle system and a doser injecting a reducing agent to actively reduce harmful emissions, particularly NOx. This system’s targeted approach to chemical treatment aligns perfectly with the core principles of CPC Y02 – ‘Exhaust Gas Treatment’ – focusing on minimizing harmful emissions through targeted treatment of exhaust gases. The variable radius mixer and precise reagent delivery are key innovations supporting Y02’s goals of optimizing reaction efficiency and reducing environmental impact. The system’s benefits – reduced greenhouse gas emissions, improved air quality, and potential fuel efficiency – further solidify its place within Y02.","While the invention incorporates elements of exhaust gas treatment, the reliance on a reactive reducing agent and the relatively conventional design of the mixer significantly limit its justification for Y02 classification. The ‘chemical treatment’ is highly sensitive and dependent on precise conditions, unlike established emission control technologies. The variable radius mixer is a feature, not a fundamental innovation, and the system’s core function – the injection and reaction of a reducing agent – aligns more closely with Y02F (Exhaust Gas Recirculation) or Y03C (NOx Reduction Systems).  The system’s vulnerability to exhaust composition and reagent concentration weakens the argument for a primary Y02 classification.",0,"The arguments presented highlight a key tension in the classification. While the advocate’s emphasis on the ‘targeted chemical treatment’ and innovative mixer design leans towards Y02, the skeptic’s points regarding the reactive reducing agent and the mixer’s conventional nature are valid. The system’s reliance on an external chemical substance and the sensitivity of the NOx reduction process suggest that Y02 is too broad a classification. A more appropriate classification would be Y03C – NOx Reduction Systems – which more accurately reflects the system’s core function of actively reducing NOx emissions through a chemical reaction, acknowledging the doser’s role in controlling the reagent delivery."
8655179,"This patent claim represents a significant advancement in communication technology by intelligently managing network resources to minimize energy consumption and reduce e-waste. The automatic sub-network setup, intelligent message routing, and utilization of existing network gateways directly align with the core principles of CPC Y02 – ‘Green Communication Technologies’ – and contribute to a more sustainable technological landscape. The system’s design inherently promotes efficiency and reduces the environmental impact associated with traditional infrared control systems.","The patent’s claims, while describing a networked infrared control system, rely heavily on interpretation and assumptions regarding energy savings and e-waste reduction. The added complexity of network gateway detection, sub-network establishment, and broadcasting introduces processing overhead and doesn’t inherently reduce energy consumption. The ‘circular economy’ benefit is speculative and doesn’t address the lifecycle of the network gateways themselves. A more appropriate classification would be within broader communication network categories.",0,"The arguments presented highlight a fundamental disagreement regarding the patent’s core innovation. While the advocate persuasively argues for Y02 based on intelligent network management and resource optimization, the skeptic correctly points out the added complexity and potential energy consumption associated with the network gateway infrastructure. The patent’s benefits are largely dependent on assumptions about behavior, not inherent technological design, and therefore, a classification under Y02 is not fully supported by the evidence presented. The patent’s core functionality remains infrared remote control, making a broader communication network classification a more accurate reflection of its technical content."
9533469,"Claim 1 represents a genuinely innovative application of materials science with significant environmental benefits. The self-healing functionality, driven by thermally activated material behavior, directly addresses issues of material waste, energy consumption, and VOC emissions – all central themes within the CPC Y02 classification. The ‘stored strain energy’ release mechanism is a critical element, transforming a potential failure point into a repair opportunity and embodying sustainable design principles.","The argument for Y02 classification is overly broad and potentially misleading, failing to adequately address the inherent limitations and, frankly, the somewhat superficial nature of the ‘green’ claims being presented. The claimed benefits – reduced material waste, lower energy consumption, and reduced VOC emissions – are overstated and dependent on specific circumstances, lacking rigorous quantification and a comprehensive lifecycle assessment.",0,"The advocate’s arguments effectively highlight the potential for reduced material waste and energy consumption through thermal activation. However, the skeptic’s concerns regarding the overstated claims, the reliance on a predetermined temperature for activation, and the lack of a comprehensive lifecycle assessment are valid. While the invention demonstrates a novel material system, the core benefits are not sufficiently transformative to warrant classification under Y02, which is typically reserved for more fundamentally innovative green technologies."
9256316,"This patent claim represents a significant advancement in energy efficiency within display systems. The intelligent control of the internal display backlight, triggered by external display coupling and maintaining touchscreen functionality, directly addresses a core Y02 principle – optimizing energy consumption through intelligent component management. The cumulative effect of this technology across a large installed base of devices would translate into substantial energy savings and contribute significantly to sustainable device design, justifying classification under Y02.","The patent claim describes a highly common and well-established feature within modern display systems – the automated orchestration of existing display driver and touch sensor control components. The ‘intelligent control’ is simply a sophisticated implementation of known techniques, lacking a fundamentally novel energy-saving method. Classifying this under Y02 risks over-interpreting the claim’s scope and diluting the significance of the Y02 classification for genuinely innovative energy efficiency solutions.",0,"Both arguments highlight valid points. The advocate correctly identifies the intelligent control and potential for energy savings, aligning with Y02’s goals. However, the skeptic’s critique is more persuasive. The claim’s core innovation appears to be the *implementation* of existing technologies rather than a fundamentally new energy-saving method. The described control scheme is a standard feature in modern displays, and the claim lacks a truly novel approach to reducing backlight power consumption. Therefore, based on the evidence presented, a Y02 classification is not warranted."
9758791,"Patent Claim 1 represents a core application of green technology principles by engineering a transgenic plant with improved traits for higher nitrogen use efficiency, greater biomass, and increased yield – all critical for sustainable agriculture. The use of a recombinant polynucleotide targeting the EAR motif directly addresses resource efficiency and reduces the environmental impact of traditional farming practices, aligning perfectly with the goals of CPC Y02.","The advocate’s argument relies on overly broad claims of ‘sustainable agriculture’ and fails to adequately address the potential risks and unintended consequences of genetically modifying plants. The 90% sequence identity argument is insufficient, and the claim doesn’t sufficiently consider the broader ecological impacts of introducing a transgenic plant into the environment, particularly regarding potential for horizontal gene transfer and unforeseen ecosystem effects.",1,"The advocate’s arguments regarding resource efficiency and alignment with Y02’s goals are compelling, particularly the focus on quantifiable improvements like nitrogen use efficiency and yield. However, the skeptic’s concerns regarding potential ecological risks and the lack of a comprehensive assessment of long-term impacts are valid. Ultimately, the patent’s potential for positive environmental impact, specifically through enhanced resource utilization, outweighs the acknowledged risks, justifying classification under Y02."
9056098,"This patent claim represents a significant advancement in cancer treatment by leveraging a naturally occurring molecule – hemoglobin – to deliver oxygen directly to hypoxic tumor environments. This mimics a natural biological response, reduces toxicity by facilitating targeted delivery of chemotherapeutic agents, utilizes a sustainable resource, and ultimately promotes systemic health and resilience. The method’s core innovation aligns perfectly with the principles and benefits of green technology, justifying classification under CPC Y02 as a biological treatment focused on disease treatment.","The classification under Y02 is a misinterpretation of the patent’s invasive and potentially detrimental approach to cancer treatment. The method’s aggressive manipulation of the tumor microenvironment, combined with the inherent risks of inducing oxidative stress and utilizing chemotherapeutic agents, does not align with the values of green technology. The claims of reduced toxicity and sustainable resource utilization are premature and require significant scrutiny, and alternative classifications more accurately reflect the invention’s core aspects.",0,"Both arguments highlight valid points. The advocate’s emphasis on utilizing a natural molecule and reducing systemic toxicity is compelling. However, the skeptic’s concerns regarding the invasive nature of the treatment, the potential for increased toxicity, and the lack of a robust lifecycle assessment of the hemoglobin production process are equally valid. Given the inherent risks and uncertainties associated with the method’s design, a Y02 classification is not fully supported by the evidence presented. The patent’s focus on a highly aggressive intervention outweighs the benefits of utilizing a natural component."
9584218,"Patent Claim 1’s method of monitoring optical fibers in a distributed radio base station system directly addresses energy waste by minimizing downtime and reducing the need for redundant network paths. The proactive fault detection inherent in the system aligns with Y02’s focus on optimizing existing infrastructure and reducing resource consumption, contributing to a more sustainable telecommunications infrastructure. The CPRI protocol itself is designed for efficient data transmission, further enhancing the system’s green credentials.","The advocate’s claims of reduced energy waste are overly simplistic and potentially misleading. The system’s primary function is network diagnostics, and the energy consumption associated with its operation – including redundant systems activated by alarms – could actually *increase* energy use. The argument conflates detection with prevention and overlooks the inherent energy consumption of monitoring and analysis systems.",0,"While the patent addresses a relevant issue in network management, the arguments presented by the advocate are overly reliant on a simplified view of energy consumption. The skeptic’s concerns regarding potential increased energy use due to redundant systems and monitoring infrastructure are valid and outweigh the advocate’s claims. Therefore, a classification under Y02 is not justified based on the presented evidence."
9340399,"The patent claim describes a system that actively monitors warehouse lighting and, through processor-executed instructions, adjusts light output to reduce energy consumption. This directly aligns with CPC Y02’s focus on systems for monitoring and controlling energy consumption, particularly through intelligent automation and feedback loops. The system’s proactive approach to dynamic lighting control represents a significant contribution to sustainable practices and minimizes a major energy drain within a warehouse environment.","The claim lacks a demonstrable mechanism for actively reducing energy consumption. The processor’s ability to ‘adjust their output’ is merely stated, without specifying how this adjustment is achieved or guaranteeing its effectiveness. The system’s reliance on external factors – existing lighting controls and warehouse conditions – renders it passive observation rather than active control, failing to meet the core requirements of CPC Y02.",0,"Both arguments highlight valid points. The advocate correctly identifies the system’s potential for energy reduction through dynamic lighting control, aligning with Y02’s objectives. However, the skeptic’s concerns regarding the lack of a demonstrable control mechanism are well-founded. The claim’s description relies heavily on the processor’s ability to execute instructions, without specifying the control logic or guaranteeing its effectiveness. Therefore, based on the current evidence, the claim does not sufficiently demonstrate active energy control to warrant classification under CPC Y02."
9632080,"This diagnostic multi-layer dry phase test strip with integrated biosensors represents a significant advancement in electrochemical sensing technology, offering a sustainable solution for both clinical diagnostics and environmental monitoring. The use of electrochemical interaction, point-of-care diagnostics, miniaturization, and reduced chemical consumption strongly supports classification under CPC Y02, aligning with the classification’s focus on electrochemical sensors for environmental applications.","The patent’s claims rely on broad interpretations of ‘electrochemical interaction’ and ‘dry phase,’ without sufficient evidence to demonstrate a genuinely green technology. The technology’s core functionality – a diagnostic test strip – doesn’t inherently prioritize environmental sustainability, and alternative classifications like Y02F or Y03J would be more appropriate given the electrochemical principles and multi-analyte detection capabilities.",0,"The advocate’s arguments, while enthusiastic, overstate the inherent green aspects of the technology. The skeptic’s concerns regarding the broad interpretation of ‘electrochemical interaction’ and the lack of concrete evidence for reduced environmental impact are valid. The patent’s core function as a diagnostic test strip, rather than a dedicated environmental sensor, makes Y02 a less precise classification than other options, leading to a decision against green tech classification."
8540165,"An electronic card assembly utilizing thermal sensitive adhesion tapes, a stiffening substrate with a matched thermal coefficient, and a flexible battery insert represents a significant green technology innovation by fundamentally addressing ‘planned obsolescence’ and promoting extended product lifecycles through repairability and material conservation. This design aligns perfectly with the core principles of CPC Y02, focusing on durable, repairable, and sustainable electronic products.","The patent’s claims rely on existing engineering practices – thermal adhesion, thermal coefficient matching, and impact-resistant battery inserts – rather than a novel green technology. The ‘revolutionary’ aspects are primarily driven by cost optimization and risk mitigation, and a more appropriate CPC classification would be within Y02.08 or Y02.09, reflecting the assembly’s function as a standard electronic card.",0,"The advocate’s argument overstates the novelty of the design, focusing on the potential for repairability as a revolutionary green technology. While the features contribute to durability and potentially extended lifespan, they are largely based on established engineering practices. The skeptic’s assessment is more accurate, highlighting the assembly’s function as a standard electronic card with enhanced features, and a classification within Y02.08 or Y02.09 is more appropriate based on the available evidence."
